Keywords searched,Job title,Date parsed,Company name,Location,Occupation,Job rank,Content,Date published
Python Developer,Scientific Software Developer (C++),2019-11-16,Universität Basel,Basel,100%,Position with responsibilities,"Scientific Software Developer (C++)         Scientific Software Developer (C++) 100% - Starting immediately or as per agreement     sciCORE is the center for scientific computing at the University of Basel and one of the technological platforms of SIB (Swiss Institute of Bioinformatics). The main mission of sciCORE is to support scientists at the University of Basel and associated institutes in research domains with high computational demands. Current projects range from life sciences and medicine to physics, chemistry, economy, and humanities.The Swiss Tropical and Public Health Institute (Swiss TPH) is a world-leading institute in global health with a particular focus on low- and middle-income countries. Associated with the University of Basel, Swiss TPH combines research, services, education and training at the local, national, and international level. It aims to improve the health and well-being of populations through a better understanding of disease and health systems and by acting on this knowledge.sciCORE invites applications for a software developer proficient in C++ (100%) to work in close collaboration with the Swiss TPH.       Your position  We are looking for a candidate with excellent collaborative skills and experience working in an academic environment. Our new collaborator will work on the software development of OpenMalaria, an open-source C++ program for simulating the impact of interventions against malaria on the associated epidemiology. OpenMalaria is a living research resource, which requires adaptation and maintenance of existing code (bug fixes, refactoring), implementation of new methodologies, performance optimization and maintenance of up-to-date documentation to suit the needs of researchers. Our collaborator will be the main contributor to this maintenance and improvement effort, but will benefit from the expertise of the developer team at sciCORE.The position will be hosted at sciCORE, but will require close collaboration with the Infectious Disease Modeling Unit of Swiss TPH, which has the scientific lead on the OpenMalaria project.    Your profile  Essential:   Masters in computer sciences, computational life sciences, bioinformatics, physics, mathematics, engineering, or equivalent Advanced proficiency in C++ and Python Strong experience of work in Linux environment Experience with best practices in software development, including unit testing, version control systems (Git), and the management of publicly accessible codes via GitHub or similar Ability to work well on a team within an academic/scientific environment and to collaborate and communicate effectively with the target users during the entire software development process Capability to multi-task with accuracy and reliability and a demonstrated ability to prioritize tasks and meet deadlines Fluent in English (oral and written working language) Desirable: Experience in Continuous Integration/ Continuous Development Experience in containers (singularity, docker, docker-compose, kubernetes) Experience in code optimization and in parallelization with MPI and/or openMP Familiarity with agile software development       We offer you    A highly interdisciplinary work environment with challenging tasks A management working on agile principles Work within a team of experienced and highly motivated software developers, data analysts, and scientific IT specialists. Opportunity to work and gain experience with cutting-edge computing technologies, from hardware to management tools An environment supporting career development (own training, networking, conferences) An initial contract for two years, with the option for extension      Application / Contact  We look forward to receiving your online application including the following documents: CV, letter of interest, references and code examples (e.g. link to a repository in GitLab, GitHub or similar). Please note that we exclusively accept applications submitted through our online application portal. Applications via email or postal services will not be considered. For further information regarding the position please contact Dr. Lorenza Bordoli by e-mail: scicore@unibas.chThe position will remain open until filled.   Apply    www.unibas.ch              Display original ad",05.11.2019
Python Developer,Frontend Developer Internship (m/f) (50-100&percnt;),2019-11-16,,,100%,Position with responsibilities,"Frontend Developer Internship (m/f) (50-100&percnt;)   Careers  Current Job Openings at Aspaara  Currently we have no open positions.  Recent Job Openings at Aspaara Deadline has passed (November 16th, 2018).Frontend Developer Internship (m/f) (50-100&percnt;)DeveloperAlgorithm and Software Junior Developer (m/f) (50-100&percnt;)DeveloperFrontend Developer Internship (m/f) (50-100&percnt;)  Join the Aspaara Team!  We are looking for a Frontend Developer Intern in Technopark, Zurich. Together with our clients we develop innovative and digital solutions. With great software solutions we shape our digital future together. We are not bound to trends, fashions or certain industries. We try to tackle challenges with a broad and open-minded attitude together with our clients. We love challenges! If you do too, apply for the position! As a Frontend Developer Intern you will work in the development of future technology. We expect a high willingness to learn, excellent software development skills, and creative thinking. Bridge the gap between academia and industry! Your Challenge Learn how to develop digital ideas and concepts, analyze optimization potentials, verify hypotheses, develop algorithms, implement software code, and deliver solutions in a short period of time with our team! You will accompany the development for future solutions. Your Background Required skills:   Frontend development experience with JavaScript or TypeScript, HTML5 and CSS. Bachelor/Master/PhD in Computer Science, Mathematics, Engineering or Natural Sciences. Fluent in English or German. Structured working style and an independent way of working. Networked, solution-focused and entrepreneurial way of thinking. Passion for customer focused digital technology. Outstanding analytical abilities.  Optional skills:   Webapp frontend framework experience (ReactJS or similar). Python experience. Java experience.  Our Offer Join our inspiring working environment in Technopark Zurich, an entrepreneurial team, competitive salary, weekly team lunch, and a lot of fun! Together we will develop digital solutions in various fields: Intelligent Staffing, Fast Prototyping, Operations Management, Industry Solutions, Data Analytics and Logistics Optimization. We offer a full or part-time employment immediately (or by arrangement) with flexible working hours in our Zurich office in Technopark. You will have access to the greatest innovation network in Switzerland, the Swiss Alliance for Data-Intensive Services. The Alliance is supported by Innosuisse (Swiss innovation agency), various industry, and academic members. It is a hub for data-driven value creation standing for innovation in the entire data-driven value creation chain. How to Apply Send your application to Job@Aspaara Algorithmic Solutions AG. Please give us an impression of already completed projects (preferably with links to repositories) in your application. Do not hesitate to ask if you have any further questions or remarks. Application deadline: Friday, November 16th, 2018   Display original ad",18.10.2018
Python Developer,Java Developer Derivatives Technologies,2019-11-16,swissQuant Group AG,Zürich,100%,Position with responsibilities,"Java Developer Derivatives Technologies   Hours: 100%   Location: Zurich   Duration: start date negotiable   swissQuant Group bietet eine breite Palette von Dienstleistungen, Beratung und quantitativen Tools für den Finanz- und Industriesektor für Kunden in und ausserhalb der Schweiz an. Zu unseren Kunden zählen auch mehrere Fortune 500-Unternehmen. Unsere Kernkompetenz liegt in der Umsetzung von Intelligenter Technologie in einen substantiellen Mehrwert für unsere Kunden. swissQuant Group ist ein privat geführtes Unternehmen, das im Jahr 2005 als Spin-off der ETH Zürich gegründet wurde.  Position As a Developer you will use your skills and experience across technology and finance to create industry leading software components for pricing and risk models, algorithms and computational methods and optimization frameworks. Scope You are an expert in Java programming language. You can work independently or as part of small groups in the development and delivery of software components and services. Your mastery of technology allows you to build prototypes quickly to help support business development and to build high quality robust products. You will be responsible for the technical delivery of multiple projects and provide technical leadership to other quant engineers in software design and development. You will liaise with clients and technology partners to identify requirements and define technology architecture. You are confident and articulate and possess excellent presentation skills. Your excellent multi-tasking and time management skills complete your profile and ensure your success. Requirements To be a successful candidate, you must fulfil the following requirements:   University degree in a quantitative discipline such as Computer Science, Engineering, Physics, Mathematics or Applied Sciences   Excellent computer programming skills, particularly in core Java/J2SE, multithreading, system design   Ability and ambition to write well-structured, sufficiently covered with unit-tests, easy-to-maintain and clean code   Knowledge of most (but not necessarily all) of these concepts and technologies: • Messaging, JMS • System architecture design and performance optimization for high throughput and low latency systems • Reactive programming, Spring • • RDBMS (MySQL, Oracle), in-memory data grids, NoSQL databases • TDD/BDD • Containers (Docker, Kubernetes), Clouds (AWS, Google Cloud) • Web programming (HTTP, REST, HTML, Javascript, React) • Basics of Python     Minimum basic knowledge of financial instruments, derivatives markets and modelling (in-depth knowledge is a strong advantage)   Fluency in English is required, German is a plus.   Effective project management and time management skills  Java Developer Derivatives Technologies (PDF, 150 kb) Display original ad",22.03.2018
Python Developer,Senior Java Developer,2019-11-16,,,100%,Position with responsibilities,"Senior Java Developer Duties for this position will include the analysis, design, development (full development life cycle), and support of Core Java / J2EE applications. We require a person that is highly analytical and adept at solving complex problems. As Developer of new applications, you will be expected to maintain these in production till you provide appropriate instructions and documentation to the Technical Support group. Qualifications:  Bachelor’s / Master's degree in Engineering or Science At least 8 years of IT experience including 5 years of Java programming experience  Key Requirements:  Excellent knowledge and experience in Java Core and J2EE development. Experience with Web or Application server (JBoss, Tomcat etc.) and application framework (like Spring etc.) Experience with network protocols and messaging: Socket, RMI, JMS (REST, SOAP), Asynchronous Messaging Brokers like Hornet Q,Apache MQ etc. Experience in the development of concurrent, multi-component, heavy duty and high-performance distributed java applications. Good knowledge of relational databases with hands on experience with Oracle or MySQL. Experience with setting up monitoring tools like Nagios, Ganglia etc. Experience with: build system (like Ant, Ivy etc.), and version control systems (like GIT, CVS etc.) Strong analytical skills. Good communication skills.  Ideal Requirements:  Knowledge of communication technologies like: SIP, SMPP, XMPP. Knowledge of software development methodologies and design patterns. Experience with scripting language like Perl, python etc. Experience of working in the Linux environment.  Company Overview: Interactive Brokers (""IBKR""), a subsidiary of publicly-traded Interactive Brokers Group, Inc., based in Greenwich, Connecticut (NASDAQ: IBKR) is a low-cost provider of trade execution and clearing services for active traders, institutional investors, financial advisors and introducing brokers. IBKR’s premier technology provides electronic access to stocks, options, futures, forex, bonds, and funds worldwide from a single IBKR Integrated Investment account. IBKR is one of the largest online brokers by trade volume and is consistently ranked at the top of its field. IBKR is a member of NYSE, FINRA, and SIPC. Interactive Brokers Group brokerage affiliates are regulated by securities and commodities agencies around the world. Our employees are part of a dynamic, multinational, fast-paced, results-oriented team working to provide our customers with state-of-the-art trading technology, superior execution capabilities, worldwide electronic access, and sophisticated risk management tools. Our headquarters are in Greenwich, CT, USA. IBKR has offices in the United States, Canada, the United Kingdom, Switzerland, Hungary, Estonia, Russia, India, Hong Kong, China, Japan, Luxembourg and Australia. Interactive Brokers Financial Services (“IBKRFS”) in Zug is regulated by the Swiss Financial Market Supervisory authority (FINMA). Click HERE to view a short video with a few words from current Interactive Brokers employees. For more information, please visit www.ibkr.com/info    Display original ad",17.07.2019
Python Developer,Bioinformatics Software Developer,2019-11-16,Stalicla SA,Genève,100%,Position with responsibilities,"Bioinformatics Software Developer Barcelona, September 20th, 2019  Bioinformatics software developer The CompanySTALICLA is a near clinical Company developing a first in class precision medicine platformto accelerate drug development for patients Neurodevelopmental Disorders (NDD). Firstfocus of development has been Autism Spectrum Disorder (ASD). Today, patients diagnosedwith ASD account for 1-1.5% of the world population. The condition remains a high unmetmedical need.In its Geneva and Barcelona units, STALICLA has assembled a world class team ofexperienced drug developers and computational biologists. The company is recognized as adisruptive player, using its DEPIv3 AI & statistical modelling platform to identify subgroupsof patients with ASD and corresponding candidate drugs.It is the first time that such technologies have been utilized within the fieldof neurodevelopment with the potential to change the direction of the specialty.Patients are then characterized through biomarker preclinical and clinical investigations.  In just over 2 years, the STALICLA platform has already proven successful in  expediting and de-risking drug development for a first subgroup of patients with  Autism and identifying two additional subgroups.  STALICLA’s first therapeutic package - STP1 - addresses a distinct sub-group of ASD patientsestimated to 1.5-2M people in the EU and North America. Clinical entry for STP1 is plannedin Q1 2020.To support its platform and pipeline development, STALICLA has developed a network of toptier research and clinical partners in the US.This has enabled STALICLA to gather one of the largest Autism patient Electronic HealthRecord databases to date. STALICLA is currently applying its DEPIv3 discovery model to advance new pipelines foradditional groups of patients.In Q1 2019 – Three new modules have been added to the DEPIv3 platform, exponentiallyincreasing its capacities for single and combination drug repositioning and for identificationof clinical trial stage drug high responder patients. BackgroundSTALICLA is expanding on its R&D computational systems biology unit in Barcelona. Theresearch and development unit of STALICLA in Spain focuses on the identification ofsubgroups of patients based on genetic, phenotypic and clinical factors, integratingmolecular, anatomical and medical data. Through biomedical big data analysis, the researchunit leverages on existing molecular entities to bring tailored treatments to patients withNDDs. The fundamental elements of DEPIv3 include the computational analysis of omicsdata (proteomics, genomics, transcriptomics, metabolomics, etc.) and personalized systemsmedicine. Analysis involves statistical modeling and machine learning centered on thebiology of diseases, comorbidities and pharmacology.World Trade Center | Moll de Barcelona, s/n, Edif Este | 08039 Barcelona | Spain | + 34 931 682 868 PositionTitle: Bioinformatics software developerLocation: World Trade Center, BarcelonaDuration: PermanentSalary: Competitive - depending on experience and profile  Candidates living in Barcelona or EU and able to relocate rapidly would be preferable.  The roleThe bioinformatics software developer will work closely with the other members of the unitand contribute to the design, implementation and the analysis of computational models andalgorithmic approaches towards the characterization of “targetable” molecular, genetic andclinical features in neurodevelopmental disorders. S/he will participate in developingbiomedical data analysis pipelines within the context of ongoing computational systemsbiology projects, ranging from the identification of biological pathways associated with ASDand comorbid neurodevelopmental disorders, to deployment of our next-generationsequencing and clinical data mining pipelines. Candidates with previous experience onsequence analysis (genomics and/or transcriptomics), workflow development, and cloudcomputing, or who are open to learning these skills, are preferred. Work environmentThe STALICLA R&D office is located by the sea, overlooking the port of Barcelona and it haseasy access to the public transportation. Perks at the office include free coffee, tea and freshfruits. Desired skills & software  Linux, shell scripting, Git, Makefile, Nextflow (or equivalent) Python and/or R Experience with cloud computing (AWS preferred) Use of software containers (Docker and/or Singularity) NGS pipeline development and analysis (RNAseq and/or WGS, WES) MySQL, Neo4j, MongoDB or equivalent (optional) Good communication skills in English A passionate, energetic and enthusiastic personality  Desired capabilities   Build and optimize computational pipelines to process, integrate, analyze, summarizeand visualize large scale interconnected biomedical data including but not limited togenomics, transcriptomics, proteomics, metabolomics, clinical, and pharmacologicaldata.   Deploy existing computational pipelines on the cloud to enhance scalability, as well asdata security, by using advanced security featuresWorld Trade Center | Moll de Barcelona, s/n, Edif Este | 08039 Barcelona | Spain | + 34 931 682 868   Contribute to the strategical planning and development of new and existing projectsand generate high quality documentation of materials, methods, software and analysisresults.   Have a solid understanding of molecular data analysis (i.e. quality control,normalization, clustering, differential expression, pathway enrichment), featureengineering and prediction model validation.   Knowledge on widely used biological data resources (such as UniProt, GWAS catalog,Reactome, UMLS) and disease ontologies is a plus.   Previous experience on pharmacological data analysis and drug repurposing is a plus.   In addition, the candidate is expected to have:  A high comfort level working in a high paced start-up environment, where a pragmatic,resourceful, well organized and effective approach is required with limited resources A hands-on, decisive approach and a proven ability to work independently and as ateam player Excellent communication skills A passionate, energetic and enthusiastic personality that will ensure commitment tothe company and its vision  Application procedurePlease send a copy of your CV along with the info on your availability to info@stalicla.com World Trade Center | Moll de Barcelona, s/n, Edif Este | 08039 Barcelona | Spain | + 34 931 682 868Display original ad",25.09.2019
Python Developer,Senior C++ Software Developer (100%),2019-11-16,Nanolive SA,Ecublens VD,100%,Position with responsibilities,"Senior C++ Software Developer (100%) What we are looking for   To accelerate projects and growth, Nanolive is looking for strengthening its development team with a highly motivated and outstanding senior Software Engineer (100%).   The mission of the back-end engineer is focused on the reliability and performance of the software developed at Nanolive. The tasks of the candidate who will collaborate with the development team are:  Development of the exploitation software of the Nanolive products Development of production and maintenance software tools Development of new features: from Proof of Concept to implementation, documentation, testing and benchmarking     Skills and Knowledge Master’s degree in Computer Science, Mathematics, Engineering or related area. Minimum 5 years of experience and full proficiency in modern C++. Experience in Python an asset. Knowledge on Qt, CMake, Unit Testing, CI/CD technologies (TeamCity), source control management (Git), Agile methodology. Experience in CUDA and/or high-performance computing an asset.    Requirement Have a team-player spirit, a quick perception and a resourceful and fast-learning mindset. Have a strong sense of commitment and responsibility to respect planning. Have a high analytical capacity and an adaptable, autonomous, rigorous and service-oriented mindset.    What we offer You will get the opportunity to work in a fast-growing scale-up environment with highly motivated, competent and experienced individuals, and make a real difference for our customers. You will be working with a cutting-edge technology and facing the exclusive challenge of making it accessible to a wide audience by implementing creative solutions.    Interested? Please click on “Apply Now” and fill your application including your cover letter and CV.   We do not accept any recruitment agencies.Display original ad",10.10.2019
Python Developer,"Scientific Software Developer 100%, Zurich, temporary",2019-11-16,ETH Zürich,Zürich,100%,Position with responsibilities,"Scientific Software Developer 100%, Zurich, temporaryScientific Software Developer 100%, Zurich, temporary  The Swiss National Supercomputing Centre (CSCS) is operated by ETH Zurich and its headquarters are located in Lugano, Switzerland. CSCS develops and provides key supercomputing capabilities for solving important problems in science and society. CSCS is leading an effort to develop scientific software and libraries for HPC platforms. This work involves close collaboration with domain scientists and working on cutting edge HPC technologies, to ensure that scientists will be able to fully utilize modern HPC systems. At the moment CSCS has an open position at our office in Zurich.  Job description  We are looking for candidates with a sound knowledge of computer science and enthusiasm for software development and productization. Strong working knowledge of C++, our main development language, as well as expertise in the development of numerical or scientific simulation software in an HPC environment are required. Experience with modern HPC technologies, such as CI/CD, containers and cloud computing is considered a strong point. Experience with scientific software development and engineering as part of a team is beneficial. Domain science knowledge complemented by experience in Python or Fortran is beneficial. She or he should have a Master or Ph.D. in computer science, computational science, mathematics or natural sciences. Close collaboration with domain scientists requires taking initiative and will benefit from strong interpersonal and communication skills. As an ETH employee, you should be enthusiastic about working in an international environment and have an excellent command of English. We value the diversity of our team and particularly encourage female candidates to apply.  Your profile   Master or Ph.D. in computer science, computational science, mathematics or natural sciences Strong working knowledge of C++ Fluent English   ETH Zurich   ETH Zurich is one of the world’s leading universities specialising in science and technology. We are renowned for our excellent education, cutting-edge fundamental research and direct transfer of new knowledge into society. Over 30,000 people from more than 120 countries find our university to be a place that promotes independent thinking and an environment that inspires excellence. Located in the heart of Europe, yet forging connections all over the world, we work together to develop solutions for the global challenges of today and tomorrow. Working, teaching and research at ETH Zurich Display original ad",01.10.2019
