Keywords searched,Job title,Date parsed,Company name,Location,Occupation,Job rank,Content,Date published
Python Developer,Senior Javascript Engineer - Zurich,2019-11-16,Nektoon AG,Zürich,100%,Position with responsibilities,"Senior Javascript Engineer - Zurich              
    
    
 Senior JavaScript Developer  Zurich – Updated October 2018 – Multiple Positions Open   
              
    
    
        
    
   Our team is building the platform Squirro, a Unstructured Data Discovery and Analysis platform. We combine our unique Smart Filter technology with a very easy-to-use interface so that you can easily and quickly unearth gold in your landfills of digital data.  About You  You have several years of experience in building bleeding-edge frontend applications. You have built responsive designs so that the same application works on browsers of all sizes. You have worked with at least one modern MV* framework and are excited about the new capabilities they bring to the web. You enjoy working together with our team to deliver a great client-side user experience. And you love to collaborate with our customers and business owners to help shape the future of Squirro.  Responsibilities   Extensive experience with JavaScript Experience with CSS and implementing designs in close collaboration with a designer Familiar with performance optimization techniques Up to date with the latest browser developments and how to use them in code But also able to degrade nicely to older browsers Good communication skills with fluency in English Existing knowledge in any of the following is not required but helpful: Backbone.js react.js d3.js webpack Python       Required Qualifications   Exceptional programming experience in various frontend languages Experience with testing and test-driven development Good communication skills with fluency in English Barcelona: Work permit in Spain, which is given for citizens of EU and EFTA member states Zurich: Work permit in Switzerland, which is given for citizens of EU and EFTA member states   About the team  Squirro is a Swiss startup. We are a team of passionate Internet geeks and entrepreneurs and one of the most experienced startup teams around. We love Python and ElasticSearch on the server side and JavaScript with Backbone.js on the client side. We work with Git, believe in testing, code reviews, continuous integration and continuous deployment. Our work is structured with Scrum. Our compensations package includes shares in the company because we believe our employees are our biggest asset. Our headquarter is in located in Zurich, Switzerland.      Get in Touch  Felix Hürlimann, Co-FounderEmail: jobs@squirro.comPhone: +41 44 586 98 98       See all job openings      
 Our team is building the platform Squirro, a Unstructured Data Discovery and Analysis platform. We combine our unique Smart Filter technology with a very easy-to-use interface so that you can easily and quickly unearth gold in your landfills of digital data.  About You  You have several years of experience in building bleeding-edge frontend applications. You have built responsive designs so that the same application works on browsers of all sizes. You have worked with at least one modern MV* framework and are excited about the new capabilities they bring to the web. You enjoy working together with our team to deliver a great client-side user experience. And you love to collaborate with our customers and business owners to help shape the future of Squirro.  Responsibilities   Extensive experience with JavaScript Experience with CSS and implementing designs in close collaboration with a designer Familiar with performance optimization techniques Up to date with the latest browser developments and how to use them in code But also able to degrade nicely to older browsers Good communication skills with fluency in English Existing knowledge in any of the following is not required but helpful: Backbone.js react.js d3.js webpack Python       Required Qualifications   Exceptional programming experience in various frontend languages Experience with testing and test-driven development Good communication skills with fluency in English Barcelona: Work permit in Spain, which is given for citizens of EU and EFTA member states Zurich: Work permit in Switzerland, which is given for citizens of EU and EFTA member states   About the team  Squirro is a Swiss startup. We are a team of passionate Internet geeks and entrepreneurs and one of the most experienced startup teams around. We love Python and ElasticSearch on the server side and JavaScript with Backbone.js on the client side. We work with Git, believe in testing, code reviews, continuous integration and continuous deployment. Our work is structured with Scrum. Our compensations package includes shares in the company because we believe our employees are our biggest asset. Our headquarter is in located in Zurich, Switzerland.  
  Get in Touch  Felix Hürlimann, Co-FounderEmail: jobs@squirro.comPhone: +41 44 586 98 98  
   See all job openings    
        
   Display original ad",17.03.2016
Python Developer,Embedded Software Engineer - Platform & Tools,2019-11-16,,,100%,Position with responsibilities,"Embedded Software Engineer - Platform & Tools In a life without sound, our work provides meaning. As the world’s leading hearing care provider, we are not just a company that makes products: we are a team on a mission to help people enjoy the delight of hearing. To enable a life without limitations, we – through our core brands Phonak, Unitron, Hansaton, Advanced Bionics and AudioNova – develop, manufacture and distribute solutions that push the limits of technology and redefine the future of our industry. Sonova has more than 14,000 committed employees in over 100 countries, all of whom contribute to something greater than themselves – they transform lives. Join our mission and become part of our team! Apply now for the following position:Sonova / Switzerland / StäfaEmbedded Software Engineer - Platform & ToolsIn a team of software engineers, you will develop and maintain the Sonova embedded software platform for multicore DSP programming. You will be responsible for complex custom-built software tools and infrastructure, at the core of the development environment used at R&D locations worldwide to produce DSP software for Sonova hearing aids. Moreover, you will contribute to the lowest layers of the embedded software.Your tasks  Development of the Sonova embedded software platform (Python, C, domain-specific languages, code generation) for highly efficient DSP programming Analysis of the platform and design of its extensions with architects and application developers Extension and maintenance of tools within the extensive DSP development environment (Python, C#, Tcl, git, ALM) Agile software development, code reviews and interdisciplinary collaboration  Your profile  University degree (MSc/Bsc) in electrical engineering or computer science Affinity to hardware and 3+ years of industrial experience in low-level embedded software development (C or C++) Work experience in object-oriented programming in Python Knowledge in continuous integration, automated regression testing, as well as in the realization and deployment of development tools Proven analytical, problem-solving and abstraction skills, systematic approach to design and implementation of software Service orientation and readiness to support peer developers Fluent in German and English  Our offerWe can offer you a new challenge, with interesting tasks and much more – including an open corporate culture, flat hierarchies, support for further training and development, opportunities to take on responsibility, an excellent range of foods, sports and cultural facilities, attractive employment conditions, and flexible working time models in various roles. Gianni Raffi, Corporate Talent Acquisition Manager, is looking forward to receiving your complete application (cover letter, CV, references and certificates) via our online job application platform. For this vacancy only direct applications will be considered.Sonova AG Laubisrütistrasse 28CH-8712 Stäfa+41 58 928 01 01Create impact. Transform lives – sonova.com/careers Apply                          Display original ad",04.11.2019
Python Developer,Back End Software Engineer f/m - Zürich,2019-11-16,,,100%,Position with responsibilities,"Back End Software Engineer f/m - ZürichWe connect products. Leitwert leverages the potential of digital technologies to enable new valuecreating solutions for the key challenges in industry and healthcare. Based on our expertise inelectronics, asynchronous programming and web technologies we develop modular solutions torevolutionize the industrial and health care sector. We are competent on every level of the IoT stack. Join our team as Back End Software Engineer (f/m)  Your role. You are our Back-End Software Engineer who develops server back ends and elaborates stablesoftware solutions for our challenging custom client projects. You are part of the advancement of our in-house IoT enablement platform. Your responsibilities.  You design and implement new business solutions based on our IoT platform You conceptualize customer client projects and model possible solutions with a database andsoftware design You keep track of the time and money budget of your projects You write unit tests to ensure proper function of code You review code of your team members and work in close collaboration with the front enddevelopers You support the business development team with your technical expertise  Your profile.You have a positive, proactive and open personality. You work independently and easily adapt to newchallenges. You convince with your hands-on working attitude.And you have:   5 years of hands on experience in backend design and development  Exceptional programming skills in Python Experience in source code version control (Git) and unit testing Experience with SQL/NoSQL database (PostgreSQL, mongoDB) Fluent language skills in English (German is advantageous)  Preferably you also have:  Experience with python-based backend frameworks: Django preferred (or any other: Flask,Pyramid, ...) Experience with DevOps and Linux System Administration Experience in data storage and data analytics pipelines Knowledge of Docker Software project management experience  Our offer. Leitwert offers diverse project-based work in a highly motivated team of experienced developers. Withour start-up spirit we trust in everyone’s ability to create great stuff and count on the success of ourdynamic interdisciplinary teams. We empower the people to actively shape the corporate culture. Ouroffice is in Zurich nicely situated right next to the lake. Together with you we invent the world of tomorrow.  Do you want to convince us with your elegant code? In that case, we’d be delighted to have you onboard.Hand in your complete application to: jobs@leitwert.chLeitwert GmbH Gütlitobelweg 27 Office Feldeggstrasse 4 E-Mail jobs@leitwert.chCH-8400 Winterthur CH-8008 Zürich www.leitwert.chDisplay original ad",05.06.2019
Python Developer,Support & DevOps Engineer for the Maintenance & Services Team,2019-11-16,swissQuant Group AG,Zürich,100%,Position with responsibilities,"Support & DevOps Engineer for the Maintenance & Services Team   Hours: 80 - 100%   Location: Zurich   Duration: permanent, starting immediately   swissQuant Group bietet eine breite Palette von Dienstleistungen, Beratung und quantitativen Tools für den Finanz- und Industriesektor für Kunden in und ausserhalb der Schweiz an. Zu unseren Kunden zählen auch mehrere Fortune 500-Unternehmen. Unsere Kernkompetenz liegt in der Umsetzung von Intelligenter Technologie in einen substantiellen Mehrwert für unsere Kunden. swissQuant Group ist ein privat geführtes Unternehmen, das im Jahr 2005 als Spin-off der ETH Zürich gegründet wurde.  The Maintenance & Services Team is the central point of contact for all support issues and questions. The team represents the company towards our clients by responding and resolving issues with our software products, and it contributes to the development of these product through hands-on support of the software engineering process regarding build pipelines, quality assurance and release processes. Position We are looking for an additional team member whose interests include Application Support and DevOps, with considerable work experience in these areas, ideally within financial services firms or providers. Experience working with external clients and/or internal stakeholders is relevant, as is mentoring team members. The focus of the position is twofold – firstly, ensuring the software and services we deliver to our clients are properly quality assured, packaged, documented and supportable from the ground up. Where possible this should be automated and repeatable. Secondly, providing support to our clients, including automated checks and data gathering, backed up by the development teams. The team also act as subject matter experts in the areas of supportable architectures, quality automation, packaging, and client support, helping to ensure swissQuant provides a high level of customer service.   Scope swissQuant supports all clients and applications through this support model and builds all new applications with supportability in mind from the start. The team therefore have a wide scope and involvement with all other swissQuant teams and most of our clients, and our involvement is growing steadily. Requirements As an experienced support engineer, you understand software applications from both a user and technology viewpoint, logically diagnose issues, and work with users and developers to resolve them. You are comfortable communicating with anyone, quick to pick up the phone, but also disciplined in documentation and traceability. Quality and scalability are key goals – you automate and standardise where you can; you implement monitoring, so you know immediately about problems; you like implementing new technology in a robust and reliable way; you are direct in communicating issues or concerns. To be a successful candidate, you must fulfil the following requirements:   Degree in a discipline such as Computer Sciences or Engineering, or very strong industry experience     Very strong IT background, hands-on experience of delivery and support or software maintenance     Technologies: Java, Python, SQL, Git-Maven-Nexus-Jenkins, web services & sites, Linux     Knowledgeable and experienced in cloud environments such as AWS/Google Cloud/MS Azure and containerized applications (Docker/Kubernetes)     Strong analytical and communication skills     Strong communication skills in English, at least conversational level of German  Support & DevOps Engineer for the Maintenance & Services Team (PDF, 120 kb) Display original ad",11.11.2019
Python Developer,Computer Science Intern (Greeks computation by using algorithms),2019-11-16,Swissquote Bank SA,Gland,100%,Position with responsibilities,"Computer Science Intern (Greeks computation by using algorithms)     Company Description   Join a Fintech Pioneer ! Digital technology is deeply rooted in our DNA. Since our Company’s creation in 1996 by two EPFL engineers, we have used it to democratise banking and allow our clients to make independent decisions on our web platforms. We rely on more than 250 engineers (software engineers, front-end developers, software architects, DevOps engineers and data architects) to improve our solutions. Cryptocurrencies, Artificial Intelligence, Robo-advisory, Virtual Reality... There is no limit to what we can do to revolutionise the financial world ! We are currently looking for our new Computer Science Trainee (6 months) who is enrolled in a Master in Computer Science/Communication Systems and looking for a Master Project.      Job Description   The project’s goal is to improve Greeks computation by using up-to-date algorithms and provide a reliable and efficient solution. In mathematical finance, the term ""Greeks"" describes a set of variables representing the dimensions of risk involved when trading derivative products such as Options or Warrants, and measure the sensitivity to changes in underlying parameters.  Greeks encompass many variables, each one holding with a value that reflects how the derivative moves, or the risk associated with that derivative. They are used by traders to hedge risk and understand how their profit and loss could behave as prices evolve.   Your role:    Analyze, design and implement a distributed, on-demand and reliable algorithm for Greeks computation. If time allows, integrate the algorithm with existing systems within the Bank Understand derivative products, risk and Greeks computation ·Understand the requirements of on-site stakeholders, analyze the constraints and choose a feasible solution within these constraints Develop a complex algorithm that requires non-trivial data as input and validate results Develop a REST client and integrate the solution with critical production systems      Qualifications    Currently enrolled in a Master in Computer Science/Communication Systems Very good knowledge of Java and Python      Additional Information   SQ1   Job Location  I'm interestedPrivacy Policy Display original ad",03.09.2019
Python Developer,Software Developer/DevOps Engineer,2019-11-16,Universität Basel,Basel,100%,Position with responsibilities,"Software Developer/DevOps Engineer         Software Developer/DevOps Engineer 60-100%Starting immediately or as per agreement     The Biozentrum of the University of Basel is one of the leading life sciences institutes in the world. It consists of 32 groups and 500 employees that research how molecules and cells create life, spanning the scale from atom to organism. Founded in 1971, the Biozentrum has been the birthplace of many fundamental discoveries in biology and medicine, spawning several Nobel Laureates. The Research IT technology platform is the primary contact point for scientific IT projects at the Biozentrum. We support the Biozentrum's scientists and staff with expertise, services and custom software development to facilitate research data management, analysis and collaboration.      Your position  We are looking for a Software Developer/DevOps Engineer with experience in web technologies who enjoys both sides of the software lifecycle coin: Developing state of the art applications as well as deploying and operating systems and services in production. In this role, you support the specific needs of the research groups and administrative units at the Biozentrum.  Your responsibilities   Ensuring reliable operation of our existing services within a heterogeneous service infrastructure (Linux, Windows, Citrix Hypervisor), software (application software, web servers) and databases (MySQL, PostgresSQL, MS-SQL) Software development, with an emphasis on web technologies Planning, design, transition and operation of new services. Active participation in Research IT projects, such as discussing requirements with users, developing scenarios and solutions, as well as occasional training.     Your profile  We are looking for an enthusiastic person with a Master's degree in Computer Science, Bioinformatics or equivalent relevant experience. You have not only proven programming skills, but also outstanding analytical and collaborative skills that you enjoy bringing to the table in cross-functional projects. You like to work in an agile academic work environment and embrace a service-oriented approach. Part of your duties is to make sure that our production services run smoothly. Furthermore, you are:  Very familiar with operation of Linux/Apache/* stacks, MySQL, PostgreSQL, familiar with other setups (Windows, MS-SQL). Experience with virtualization, containers, orchestration a definite plus. Experienced with web development using at least one of the following: PHP/Zend Framework, Python/Django, other frameworks a plus. Other coding and data management experience highly welcome. Comfortable applying software development best practices (source code versioning, unit testing, continuous integration, etc.) Finally, you are motivated to acquire further skills on the job and believe in continuous improvement. Good communication skills in English are required; knowledge of German is an asset.     We offer you  The Biozentrum offers a cutting-edge research infrastructure, a highly international environment that provides numerous opportunities to learn more, and excellent working conditions. The position is initially for 2 years, with the possibility of permanent employment. Salary and benefits according to University of Basel standards.     Application / Contact  Please apply online with a CV, letter of motivation, and the name/address of three references:  https://biped2.biozentrum.unibas.ch/apply/software-developer_devops-engineer   The deadline for receipt of applications is 31 December 2019. Please note that only online applications will be accepted. Further information about Research IT:  https://www.biozentrum.unibas.ch/researchit  For specific questions, feel free to contact Michael Podvinec, PhD, Head of Research IT (michael.podvinec@unibas.ch).   www.unibas.ch              Display original ad",25.10.2019
