Keywords searched,Job title,Date parsed,Company name,Location,Occupation,Job rank,Content,Date published
Python Developer,Internship Quant Developer,2019-11-16,Axpo Solutions AG,Baden,60% – 100%,Employee,"Work closely with a team of experienced quant developers Support the team in improving existing valuation and forecasting models Gradually take over responsibility for small to medium sized development items (you will be supported / tutored by a senior member of the team) Internship Quant Developer Pursuing a degree in a quantitative subject (Computer Science, Electrical Engineering, Physics, Mathematics or similar) Knowledge of data structures, algorithms, and statistics Programming experience in one or several of the following languages (C# / Scala / C++ / Python / R) Familiar with numerical and optimization methods Daniela BridaSenior Recruiterrecruiting.trading@axpo.com The Axpo Group produces, trades and distributes energy reliably for more than 3 million people and several thousand companies in Switzerland and in over 30 countries throughout Europe. Around 4500 employees combine the expertise from 100 years of climate-friendly power production with innovative strength for a sustainable energy future. Axpo is an international leader in energy trading and in the development of tailor-made energy solutions for its customers.Display original ad",01.11.2019
Python Developer,"Senior Software Engineer, Fullstack 80-100%",2019-11-16,Valora Schweiz AG,Zurich / Muttenz / Remote,80% – 100%,Employee,"Muttenz, ZürichSenior Software Engineer, Fullstack 80-100%Muttenz, Zürich Create new and work on existing systems across a wide range of projects (e.g. a clean and elegant API layer spanning across all of our legacy systems, backend APIs consumed by our web and mobile apps, production tooling for our machine learning models etc.) Improve and maintain our production environment, for example by adding monitoring and alerting (DevOps) Set up a modern development workflow for our team, including a continuous integration pipeline and automated deployments Work closely together with our frontend engineering and data science teams Support other developers in your team with technical guidance   Minimum of 3 years of software development experience in a general purpose programming language BSc degree in Computer Science, similar technical field of study or equivalent practical experience Ability to quickly get up to speed in any programming language or system if needed Ability to tackle problems outside your comfort zone and get things done without supervision Excellent spoken and written communication skills in English   Desirable:   Experience in any of the following programming languages: Java, C/C++, C#, Python, JavaScript, Rust or Go Experience working with one or more from the following: web application development, Unix/Linux environments, distributed and parallel systems, service oriented architectures, REST APIs, developing large software systems Experience working in teams following an agile software development methodology Basic knowledge of German   Build products for a customer base of more than 5 million people across 5 countries Access the resources of a big corporate but get the freedom of working in an uncomplicated environment Work from home when you need to Competitive salary 9 out of 12 points on ""The Joel Test"" (https://www.joelonsoftware.com/2000/08/09/the-joel-test-12-steps-to-better-code/) Engineering for you is more about a clean codebase, paradigms and algorithms than languages, frameworks or platforms. You have chosen your favorite stack in which you have lots of experience, but you are able to get stuff done in any environment you need to and with every change you leave the codebase better off than before.You will be one of the first members of our engineering team and will work on many different projects and touch many different systems: from our app backends (REST webservices) to our demand forecasting service and our cash register. Because our team is new, you will get to influence which technologies we will use. As a Senior Software Engineer, you will become a go to person to answer technical questions for the rest of the team. Display original ad",29.10.2019
Python Developer,Python Developer,2019-11-16,Camptocamp SA,Olten,80% – 100%,Position with responsibilities,,05.11.2019
Python Developer,DevOps Python Developer,2019-11-16,MBA Michael Bailey Associates GmbH,Zurich,100%,Position with responsibilities,,08.11.2019
Python Developer,Junior Python Developer 100%,2019-11-16,Labour Search GmbH,Wettingen,100%,Position with responsibilities,,31.10.2019
Python Developer,Django / Python web developer 80-100%,2019-11-16,Universitätsspital Basel,Basel,80% – 100%,Position with responsibilities,"Django / Python web developer 80-100%Your responsibilities:Development of the fronted and backend of the new STCS Django Web Application Set-up and maintenance of a professional project and system environment (e.g. Django, PorstgreSQL, Gitlab, Docker) at a highly secured hosting institution Participate in the development and documentation of the relational DB model for the new application Manage the migration of the existing data from the old into the new system You closely collaborate with and you are supported by the STCS Data Center (DC), an associated academic partner institution who developed a similar Django Web Application, and by the application provider of the currently running system. You are willing to travel occasionally between these partnersYour qualifications:Master or diploma in Computer Science, (bio-)informatics or a related field Professional experience at least 3-5 years Fluency in English, Level C1 Excellent programming concepts and skills in Django / Python Professional experience and understanding of the set-up, development and maintenance of a complex DB system Understanding of clinical data management systems and clinical data workflows is of great advantage Good communication skills, enjoy close team collaboration, open to discuss and implement new developments Self-contained, motivated and interested to work in an academic environment Flexible to collaborate in a complex project and to manage a variety of responsibilities in a rapidly developing multi-site cohort studyWhat we offer:Cooperative team atmosphere A family-friendly personnel policy Challenging academic research environment with the possibility to gain experience in the field of transplantation medicine and immunocompromised hosts Multidisciplinary dynamic team of clinicians, epidemiologists, statisticians, data managers and IT specialists A grown research network and infrastructure with options of scientific involvement and academic visibilityFor further information please contact Mr. PD Dr. Michael Koller, Head of STCS Data Center, Swiss Transplant Cohort Study, Telephone +41 61 328 67 32 . Mr. Georgios Michael Dimopoulos, Human Resources, ist looking forward to receiving your online application (reference number 13334).Universitätsspital BaselBewerbermanagementwww.unispital-basel.ch/jobsDisplay original ad",08.11.2019
Python Developer,Développeur de logiciel,2019-11-16,Infomaniak Network SA,Genève,100%,Employee,"Parmi ses projets, Infomaniak souhaite faire évoluer son logiciel de synchronisation pour sa future alternative à Dropbox. Dans ce cadre, nous recherchons un software developer multiplateforme (MacOS, Windows, Linux) avec une grande expérience. Le logiciel devra notamment permettre de gérer ses fichiers depuis l'explorateur/finder via le protocole WebDav, créer des liens de partage, supporter la synchronisation sélective et à la demande, et communiquer avec l'API du produit.Développeur de logicielParmi ses projets, Infomaniak souhaite faire évoluer son logiciel de synchronisation pour sa future alternative à Dropbox. Dans ce cadre, nous recherchons un software developer multiplateforme (MacOS, Windows, Linux) avec une grande expérience. Le logiciel devra notamment permettre de gérer ses fichiers depuis l'explorateur/finder via le protocole WebDav, créer des liens de partage, supporter la synchronisation sélective et à la demande, et communiquer avec l'API du produit.  Nous recherchons un développeur logiciel qui a:     une très grande expérience dans le développement multiplateforme (Windows / Mac / Linux) en C++ ou Python une expérience confirmée avec un des frameworks multiplateformes comme Qt, wxWidget, etc. une expérience pratique dans des langages natifs (Swift, Objective C, C++, .Net, C#) une maîtrise de la programmation de client discutant avec des API / protocoles réseau  une expérience avec d'autres langages/frameworks multiplateformes un plus   Si tu penses que tu peux rendre Infomaniak encore meilleure et que tu te projettes dans cette annonce, alors postule!Aucun délai de postulation n'est prévu et les dossiers de candidature seront étudiés au fur et à mesure de leur réception.25 Rue Eugène-Marziano 1227 GeneveDisplay original ad",15.11.2019
Python Developer,Java Developer,2019-11-16,SonarSource SA,1215 Geneva 15,100%,Employee,"SonarSource provides world-class solutions for continuous code quality. Our open-source and commercial products (SonarLint, SonarCloud, SonarQube) help developers and organizations of all sizes to manage the quality & security of their code, and ultimately deliver better software. SonarSource solutions support development in 25+ programming languages such as Java, C#, JavaScript, TypeScript, C/C++, COBOL and many more. With over 3,000 customers including eBay, Thales, BMW and used by more than 120,000 organizations globally, SonarSource products are the preferred and most trusted solutions on the market.  Java DeveloperSonarSource provides world-class solutions for continuous code quality. Our open-source and commercial products (SonarLint, SonarCloud, SonarQube) help developers and organizations of all sizes to manage the quality & security of their code, and ultimately deliver better software. SonarSource solutions support development in 25+ programming languages such as Java, C#, JavaScript, TypeScript, C/C++, COBOL and many more. With over 3,000 customers including eBay, Thales, BMW and used by more than 120,000 organizations globally, SonarSource products are the preferred and most trusted solutions on the market.    The SonarSource Languages Team is looking for a passionate Java Developer to create the most advanced static analyzers in the world. The impact you can have By joining our team, you will be part of an autonomous team without a manager. You will choose what to work on. Within our team you will be supported by great colleagues who are always willing to discuss. You will be able to grow your development and professional skills, and focus on what matters. On a daily basis, you will  Develop new and maintain existing features for code analyzers for different programming languages (Java, Kotlin, JavaScript, TypeScript, Python, Swift, TSQL, etc.) Evolve the way our analyzers understand code by creating ever better models and develop new rules on top of them Contribute to code quality of the hundreds of thousands of developers around the world Contribute to open source: develop open source products and contribute back to libraries used by your products Define the team’s short and long term goals  The skills you will demonstrate  Ability to develop in Java with clean code Excellent engineering skills and good Computer Science fundamentals Fluency in source code quality: tests (unit and functional), CI/CD Experience with agile practices and principles Comfortable in dealing with change and complexity Leadership; you take initiative and demonstrate your ability to lead a subject from beginning to end Self-confident to challenge the status quo as well as to be challenged Compiler frontend knowledge is not required; you will learn it while working at SonarSource  Office location SonarSource is a remote-friendly company with offices in Geneva (Switzerland), Austin (Texas) and La Roche sur Foron (France). The role can be based in either office, or possibly remote. We can consider remote workers and support relocation on a case-by-case basis.     What we do SonarSource was started by a team of developers that wanted to change the way code is built in an agile development process. The company was created to develop the open source tool SonarQube, which is now the standard in code quality management with over 120,000 instances deployed today. Every day we are focused on solving developers’ next big problem. Who we are At SonarSource we believe in people, excellence, and delivery. We’re a team of problem solvers and overachievers who seek out others who are also passionate and relentless in their respective missions. We want to work with people who are ready to fasten their seat belts and be part of an incredible ride. We work hard not because we’re told to, but because we genuinely love what we do and do what we love. If there’s one main message we want you to remember about us, it’s that we push others to be best in class at whatever they do: choose your battle, innovate, take risks, and lead change. Join us; we’ll be smarter and stronger together. Why you will love it here  You will be given ownership and challenges, team support and encouragement to help you hit your personal goals You will have the opportunity to be a leader in your domain You will have a concrete impact on a fast-growing company You will enjoy working as part of a casual, fun and passionate team You will meet and work with a talented and diverse team of 100+ professionals from 19 different nationalities You will enjoy the passion and drive of a start-up with big-company events and benefits  Route de l'Aéroport 29-31 1215 Geneva 15Display original ad",12.11.2019
Python Developer,Cloud Site Reliability Engineer,2019-11-16,Harvey Nash AG,Zürich,100%,Position with responsibilities,,15.11.2019
Python Developer,Cloud Site Reliability Engineer,2019-11-16,Stamford Consultants AG,Zürich,100%,Position with responsibilities,,15.11.2019
Python Developer,Cloud Site Reliability Engineer,2019-11-16,The Stamford Group AG,Zürich,100%,Position with responsibilities,"Cloud Site Reliability EngineerJob Description: - Be responsible for all aspects of application production support, deployment and monitoring, as well as thedevelopment of tools to support these activities - Support mission critical applications and associated platforms, ensuring the highest levels of availability,security, performance and stability are maintained at all times - Design and build tools and solutions with a strong bias towards automating as many aspects of support as possiblesuch that manual trivial support activity is reduced or eliminated - Ensure new systems / services deployed can be integrated to existing monitoring and management tools so that theperformance of the service and deviations from normal are easily anticipated and instrumented - Manage Cloud services that span storage, security, networking, and compute cloud capabilities Key deliverables - To ensure production systems run reliably at all times, that availability, performance and business process SLAs aremet or exceeded - Spend 50% of time on tickets and 50 % on improvements that deliver engineering solutions that improveinstrumentation, ease of deployment, service orchestration and other aspects of production support - reduce the burdenof manual work involved as systems and user volumes scale. - Partner with service transition managers / development leads and architects to ensure designs of new applicationsmeet expected standards in relation to Site reliability. Ensure non-functional production support requirements areconsidered early in the lifecycle of all new applications - Manage Azure Portal Dashboard, Policies, Log Analytics, Azure DevOps, Resource Manager, Subscriptions, Graph API,Powershell/cli, Visual Studio Code, Python, JSON template Creation, DevOps and Infra as Code Requirements: - Exceptional development and engineering experience and the ability to apply that knowledge to solve the complexproblem of running applications reliability at scale - Have a blend of skills including sysadmin, security, automation and the ability to code with a deep knowledge ofOperating Systems and Application Source Code, Container Fabrics, Networking, Alerting and Monitoring - Deep knowledge of Azure Resource Manager, Monitor, Alerts, Security Centre, DevOps, RBAC - Deep knowledge of application Source code such as Java/C++/C# - Deep understanding of each service across the full IT lifecycle, and ready to take requests for infrastructureservices, applications, and environments - Design of solutions (Monitoring / process orchestration / capacity management / deployment) that not only scale butcan potentially be leveraged by other parts of the organisation - Hands on experience working in both Agile and DevOps development methodologies - Confident in interacting with developers and deep diving into both Application and Infrastructure code - Willingness to challenge the status quo and introduce new ideas that will remove or reduce manual effort in relationto operating large production systems at scale. Allegis Group Limited operates as an Employment Business and Employment Agency as set out in the Conduct of EmploymentAgencies and Employment Businesses Regulations 2003. It is a company within the Allegis Group network of companies(collectively referred to as ""Allegis Group""). Aerotek, Aston Carter, EASi, TEKsystems, Stamford Consultants and TheStamford Group are Allegis Group brands. If you apply, your personal data will be processed as described in the AllegisGroup Online Privacy Notice available at https://www.allegisgroup.com/en-gb/privacy-notices. To access our Online Privacy Notice, which explains what information we may collect, use, share, and store about you,and describes your rights and choices about this, please go to https://www.allegisgroup.com/en-gb/privacy-notices. We are part of a global network of companies and as a result, the personal data you provide will be shared withinAllegis Group and transferred and processed outside the UK, Switzerland and European Economic Area subject to theprotections described in the Allegis Group Online Privacy Notice. We store personal data in the UK, EEA, Switzerlandand the USA. If you would like to exercise your privacy rights, please visit the ""Contacting Us"" section of our OnlinePrivacy Notice at https://www.allegisgroup.com/en-gb/privacy-notices for details on how to contact us. To protect yourprivacy and security, we may take steps to verify your identity, such as a password and user ID if there is an accountassociated with your request, or identifying information such as your address or date of birth, before proceeding withyour request. If you are resident in the UK, EEA or Switzerland, we will process any access request you make inaccordance with our commitments under the UK Data Protection Act, EU-U.S. Privacy Shield or the Swiss-U.S. PrivacyShield. About TEKsystems: TEKsystems provides technology staffing and services, helping businesses deploy high-calibre IT and communicationsexpertise under a range of delivery options including Staffing Services, Team Services, Global Services, and WorkforceManagement Services. Weve become a billion-dollar services company by continually building on what we do bestblending superior client service with an unrivalled ability to source and manage talent to precise specifications,resulting in successful technology executions. Our offerings address various applications, infrastructure, andcommunications needs including technology deployment services, enterprise software support services, and assetmanagement services. TEKsystems is a division of Allegis Group Limited, a wholly owned subsidiary of Allegis GroupInc., the fourth largest staffing company in the world. Allegis Group Ltd is an Employment Business and Agency.Display original ad",15.11.2019
Python Developer,IT Big Data Software Engineer,2019-11-16,UBS AG,Opfikon,80% – 100%,Position with responsibilities,"200792BRIT Big Data Software EngineerYour role Are you a highly experienced, software developer? Do you want to design and build next generation business applications using the latest technologies? Are you confident at iteratively refining user requirements and removing any ambiguity? Do you like to be challenged and encouraged to learn and grow professionally? We are looking for Software Engineers to:*	provide technology solutions that will solve business problems and strengthen our position as digital leaders in financial services*	analyse business requirements with the business analysts in a small and dynamic team*	design, plan and deliver production quality solutions using modern programming languages*	write automated tests as part of the software lifecycle*	continuously improve and drive non-functional requirements of the platforms allowing sustainability and maintainability of delivered code*	provide technical expertise and recommendations in assessing new software projects and initiatives to support and enhance our existing applications*	conduct code reviews and test software as needed, along with participating in application architecture and design and other phases of SDLC*	see that proper operational controls and procedures are implemented to facilitate the move from test to production*	support, analyse and quickly react to production issues*	provide insights into newer technologies that will form the basis of future architecture projects  Your team You will be working in the Liquidity and Funding Technology team, as part of the UBS Group Treasury Technology division in our Zurich, Opfikon office. This team provides IT solutions to manage large data and to provide reporting to the Group Treasury function at a regulatory level.As a Software Engineer, you will play an important role in designing and developing the solutions for our stakeholder.  Your experience and skills *	software engineer with a strong background in mathematics*	strong core Java working knowledge and experience*	understanding of multithreading concepts and issues*	knowledge and experience of Spring framework (MVC, Security, Web)*	working experience of in-memory databases and caches*	writing medium to advanced complexity SQL queries*	know how to track down performance issues and mitigate*	knowledge and experience in JavaScript, HTML, CSS and Web UI development*	Big Data knowledge and at least 2-4 years working experience, preferred is: Microsoft Azure; Hadoop (HDFS); Databricks; Python; Apache Kafka; Apache Spark; Docker; Kubernetes; Elasticsearch; AI / Machine Learning*	working experience of a JS framework is a plus, preferred is: Dojo*	highly desirable is MS Excel with VBA, MS Access and Oracle knowledge*	know-how to apply standards, methods, techniques and templates as defined by software development lifecycle (SDLC)*	practical experience with source code control systems and release management practices*	hands-one experience in modern agile practices towards code quality including TDD/BDD, CI/CD and code reviews*	be able to produce secure and clean code that is stable, operational, consistent and well-performing*	knowledge of the most common design patterns*	design, plan and deliver solutions in a large scale enterprise environment*	Bachelor's degree or equivalent in Computer Science with a focus in a finance-related subject You are:*	fluent in English*	focused on quality*	an excellent communicator and quick learner*	a flexible, open-minded and cooperative person*	aware of on-going technology trends and know how to pragmatically leverage their benefits*	interested in working in a fast-paced international environment as part of an international team  About us Expert advice. Wealth management. Investment banking. Asset management. Retail banking in Switzerland. And all the support functions. That's what we do. And we do it for private and institutional clients as well as corporations around the world. We are about 60,000 employees in all major financial centers, in more than 50 countries. Do you want to be one of us?  Join Us  We're a truly global, collaborative and friendly group of people. Having a diverse, inclusive and respectful workplace is important to us. And we support your career development, internal mobility and work-life balance. If this sounds interesting, apply now.  Disclaimer / Policy Statements UBS is an Equal Opportunity Employer. We respect and seek to empower each individual and support the diverse cultures, perspectives, skills and experiences within our workforce. Corporate Center Information TechnologyDisplay original ad",15.11.2019
