Keywords searched,Job title,Date parsed,Company name,Location,Occupation,Job rank,Content,Date published
Python Developer,Science IT Consultant 80 -100 %,2019-11-16,Universität Zürich,Zürich,80% – 100%,Position with responsibilities,"Science IT Consultant 80 -100 %Information Technology Science IT Consultant80-100 %The Service and Support for Science IT (S3IT) unit is part of the Information technology department at the University of Zurich, with the goal of supporting research use of IT across the university. This includes consulting, research and development in scientific computing and research data management, as well as providing access to cutting edge high-performance and cloud computing infrastructures. We are looking for an enthusiastic Science IT Consultant to enhance our team. The person in this position will have a key role in establishing collaborations with research groups and providing the support needed to successfully use IT in research.Your responsibilities  Advise researchers in how they can best solve their problems looking at the 'IT'-part of their research Help researchers scale existing scripts/code Play an active part in specialized projects which require 'IT' knowhow, as a developer, consultant or project manager Develop and roll out new services for groups or the entire University Expand the knowledge base within S3IT by becoming an expert in one of the 'IT'-domains required for the job (Cloud, Scaling, ML, AI, Distributed Computing, Clusters, HPC, etc.)  Your profile  Higher education degree in Informatics, Computer Science, or a related field Experience in scientific computing and an understanding of research IT needs Thorough knowledge of software programming (e.g. with Python) and application scaling Advanced Linux systems skills Proactive, structured and flexible way of working High organizational and problem-solving capabilities An excellent command of English and German (or the commitment to learn upon start) Strong communication skills Experience in the following areas will be considered an advantage Research data life-cycle management Storage, backup, archiving systems and operations Containers (e.g. Docker, Singularity) and virtual environments (e.g. Conda) Web backend development / REST APIs / Search technologies Web application frameworks (e.g. Django, Flask) Databases (e.g. MySQL, PostgreSQL, MongoDB)  What we offerWe offer compensation according to the high living standards of Zurich, flexible working hours and a dynamic work environment with friendly colleagues.Place of workZürichStart of employmentEmployment start date to be mutually agreed. Please submit your application by 17/11/2019.Display original ad",22.10.2019
Python Developer,Senior Software Engineer 80% bis 100%,2019-11-16,Swisscom (Schweiz) AG,Bern-Liebefeld,80% – 100%,Position with responsibilities,"Senior Software Engineer 80% bis 100%    What you achieveThanks to you, we make the most of our data: Joining a multi-disciplinary, agile team living the DevOps lifestyle, you work on a diverse portfolio of tools, frameworks, and libraries which are used in Swisscom's data lake. Fully leveraging your skills and experience, you build and maintain web applications (mostly back-end), APIs, and middle-ware. You are on board with pair programming and collective ownership, and you lead and mentor junior developers. When we discuss the architecture of our solutions, you actively participate and have a real impact on the outcome. You continuously learn new languages, frameworks, and solve complex problems in corporate IT. Plus, you provide support to our users, host trainings, and prepare documentation.  Why you succeed  Degree (ETH/Uni/UAS) in IT Experience in designing, building, testing, deploying, and maintaining software Senior-level Java/JVM experience Advanced knowledge of Python and Ansible Solid understanding of standard algorithms, data-structures, and design patterns as well as OOP design and development, data modeling, and relational databases Basic understanding of functional programming principles Exposure to data-warehousing and big data technologies: Spark/Scala is a plus Exposure to classical web development technologies: PHP/JS is a plus Results-oriented personality with high team spirit, open to give and receive direct and constructive feedback Very good English       Curious to know more?As Senior Software Engineer ... you start as soon as possible ... you can partly work from the home office ... you travel up to 20% of your working time within Switzerland   We intend to fill this position without involvement of external recruiting or placement companies.   ContactErandi +41-58-223 55 01   Job number6157 Group unitSwisscom (Schweiz) SA   Other vacancies    Senior Software Engineer     Software Engineer     Software Engineer Data, Analytics & AI     Software Engineer  All vacancies      What to expect   Fair working conditions    Fair working conditions You benefit from the progressive employment conditions of the Swisscom Collective Employment Agreement (CEA). Salaries at Swisscom are fair and market-driven with bonuses for good performance. Our salary system is transparent.    Generous employee benefits    Generous employee benefits Through its pension fund comPlan, Swisscom offers you extensive pension plans with individual savings options. We guarantee generous continued salary payments in the event of illness or accident.    Working world    Working world Swisscom actively promotes innovation and continuous improvement and you share in shaping these processes. We work in interdisciplinary teams. Co-working, prototyping and agile working methods are rooted in our culture.    Flexible working    Flexible working Our flexible, part-time or job sharing working models let you achieve a healthy work-life balance. And because travel broadens our horizons, you can either apply for unpaid leave or purchase up to two weeks of additional holiday per year.    Work and family    Work and family Helping you optimally combine your work and family life is very important to us. Swisscom provides for 18 weeks of maternity leave and 3 weeks of paternity leave. Our childcare programme assists you with matters related to taking care of your children, while the Work & Care programme lets you take care of sick family members.    Fringe benefits    Fringe benefits We offer you a generous monthly discount on certain Swisscom products. You also benefit from discounted tickets and travel cards on public transport. The healthy, low-cost meals that you can enjoy at our staff restaurants are an additional benefit.        Fair working conditions You benefit from the progressive employment conditions of the Swisscom Collective Employment Agreement (CEA). Salaries at Swisscom are fair and market-driven with bonuses for good performance. Our salary system is transparent.     Generous employee benefits Through its pension fund comPlan, Swisscom offers you extensive pension plans with individual savings options. We guarantee generous continued salary payments in the event of illness or accident.     Working world Swisscom actively promotes innovation and continuous improvement and you share in shaping these processes. We work in interdisciplinary teams. Co-working, prototyping and agile working methods are rooted in our culture.     Flexible working Our flexible, part-time or job sharing working models let you achieve a healthy work-life balance. And because travel broadens our horizons, you can either apply for unpaid leave or purchase up to two weeks of additional holiday per year.     Work and family Helping you optimally combine your work and family life is very important to us. Swisscom provides for 18 weeks of maternity leave and 3 weeks of paternity leave. Our childcare programme assists you with matters related to taking care of your children, while the Work & Care programme lets you take care of sick family members.     Fringe benefits We offer you a generous monthly discount on certain Swisscom products. You also benefit from discounted tickets and travel cards on public transport. The healthy, low-cost meals that you can enjoy at our staff restaurants are an additional benefit.    Fair working conditions You benefit from the progressive employment conditions of the Swisscom Collective Employment Agreement (CEA). Salaries at Swisscom are fair and market-driven with bonuses for good performance. Our salary system is transparent.   Generous employee benefits Through its pension fund comPlan, Swisscom offers you extensive pension plans with individual savings options. We guarantee generous continued salary payments in the event of illness or accident.   Working world Swisscom actively promotes innovation and continuous improvement and you share in shaping these processes. We work in interdisciplinary teams. Co-working, prototyping and agile working methods are rooted in our culture.   Flexible working Our flexible, part-time or job sharing working models let you achieve a healthy work-life balance. And because travel broadens our horizons, you can either apply for unpaid leave or purchase up to two weeks of additional holiday per year.   Work and family Helping you optimally combine your work and family life is very important to us. Swisscom provides for 18 weeks of maternity leave and 3 weeks of paternity leave. Our childcare programme assists you with matters related to taking care of your children, while the Work & Care programme lets you take care of sick family members.   Fringe benefits We offer you a generous monthly discount on certain Swisscom products. You also benefit from discounted tickets and travel cards on public transport. The healthy, low-cost meals that you can enjoy at our staff restaurants are an additional benefit.           Why Swisscom?   Find out what you can expect at Swisscom, what you will do and what opportunities are available to you.   Find out more     Your application   To ensure that the hiring process runs smoothly, we have summarised all the important information for you.   Find out more     About Swisscom   Swisscom is Switzerland’s leading telecommunications company and one of its leading IT companies.   Find out more    Display original ad",02.09.2019
Python Developer,Senior market risk modelling specialist (Manager/Senior Manager),2019-11-16,PwC,Zürich,100%,Position with responsibilities,"Senior market risk modelling specialist (Manager/Senior Manager)  Your tasks  You are part of the financial risk modelling team focused on quantitative advisory and auditing services in the area of risk measurement and management, including the calculation of regulatory capital under current and future requirements. You will work with a diversified team of risk and regulatory experts, data scientists, and actuaries. You will take a leading role in the audit of the implementation of FRTB, focusing on Expected Shortfall (ES), Value-at-Risk (VaR), Internal Model Method (IMM) for counterparty credit risk, and credit valuation adjustment (CVA) approaches by leading banks in Switzerland. This entails providing assurance and adding value on model permissions under the current Basel 3 and the future Basel 4 rules. You and your team provide Subject Matter Expert (SME) inputs into audits with focus on compliance with regulatory requirements about risk modelling, valuation, stress testing, and other areas of relevance for decision-making. You will take a leading role in assessing the appropriateness of models due for approval by various regulators. You will take a leading role in leveraging emerging technologies available at PwC, including Artificial Intelligence (AI) and Robotic Process Automation (RPA), around market risk modelling. You are actively involved in developing value-adding client proposals and solutions and taking these to the market. You interact with risk managers, traders, model developers and validators, internal auditors, and regulators. You are involved in local and global initiatives by PwC, such as Regulatory Reform, e.g. Basel IV, or market reforms, e.g. the reform of reference interest rates. You build on an existing specialist reputation in the market by speaking at external and internal conferences, professional network events, and the publication of articles and flyers.    Your profile  You have a Master or PhD degree in an applied quantitative discipline (e.g. Statistics, Econometrics, Actuarial Science, Financial Engineering, Applied Mathematics, Quantitative Finance) and you may have completed your CQF, CERA, CFA, PRM, or FRM diploma. You have 6 to 10 years of experience of working in the area of quantitative financial modelling in the banking industry or in a supervisory capacity. Experience in assurance or prudential work on market risk measurement and management would be an asset. Experience in interactions with FINMA would be an asset. Experience with advanced approaches for counterparty credit risk, especially the Internal Model Method (IMM), would be an asset. You are able to work independently and as a strong team player. The role involves coordinating multiple demands and priorities, which requires attention to details, strong analytical and problem-solving skills, and the ability to consistently deliver quality results. You have the ability to develop strong client relationships, both externally and internally, in order to increase consulting and assurance opportunities. You have excellent communication skills in English. German or French would be an asset. A key emphasis will be to communicate technical complexity to both technical and non-technical audiences, which will occasionally include regulators. You have experience in coding and command at least one of the following programming languages: R, SAS, or Python.    Who we are – PwC as an employer  At PwC, we create value for both our people and clients in Assurance, Tax & Legal, Consulting, Deals and Digital Services. And you can do the same. Want to make an impact and shape the future of a leading professional services firm? Are you passionate and ready to embrace change? Then you've got what it takes to reimagine the possible. Everyone's career path is unique. That's why PwC offers countless personal and professional development opportunities that fit with your aspirations, supporting you to grow your own way – so you can become everything you want to be and more. More about Assurance Display original ad",02.05.2019
Python Developer,"Senior Software Engineer, Fullstack 80-100%",2019-11-16,Valora Schweiz AG,Muttenz,80% – 100%,Position with responsibilities,"Senior Software Engineer, Fullstack 80-100%   Each and every day, around 15,000 employees in the Valora network work to brighten up their customers’ journey with a comprehensive convenience and food offering – nearby, quick, convenient and fresh. The more than 2,700 small-scale outlets of Valora are located at highly frequented sites in Switzerland, Germany, Austria, Luxembourg and the Netherlands. The company includes, among others, the formats k kiosk, Brezelkönig, BackWerk, Ditsch, Press & Books, avec, Caffè Spettacolo and the popular own brand ok.– as well as a continuously growing range of digital services. Valora is also one of the world’s leading producers of pretzels and benefits from a well-integrated value chain in the area of baked goods.  Zurich / Muttenz / Remote Senior Software Engineer, Fullstack 80-100%Engineering for you is more about a clean codebase, paradigms and algorithms than languages, frameworks or platforms. You have chosen your favorite stack in which you have lots of experience, but you are able to get stuff done in any environment you need to and with every change you leave the codebase better off than before.You will be one of the first members of our engineering team and will work on many different projects and touch many different systems: from our app backends (REST webservices) to our demand forecasting service and our cash register. Because our team is new, you will get to influence which technologies we will use. As a Senior Software Engineer, you will become a go to person to answer technical questions for the rest of the team. Key tasks and responsibilities    Create new and work on existing systems across a wide range of projects (e.g. a clean and elegant API layer spanning across all of our legacy systems, backend APIs consumed by our web and mobile apps, production tooling for our machine learning models etc.) Improve and maintain our production environment, for example by adding monitoring and alerting (DevOps) Set up a modern development workflow for our team, including a continuous integration pipeline and automated deployments Work closely together with our frontend engineering and data science teams Support other developers in your team with technical guidance    Key skills / requirements    Minimum of 3 years of software development experience in a general purpose programming language BSc degree in Computer Science, similar technical field of study or equivalent practical experience Ability to quickly get up to speed in any programming language or system if needed Ability to tackle problems outside your comfort zone and get things done without supervision Excellent spoken and written communication skills in English   Desirable:   Experience in any of the following programming languages: Java, C/C++, C#, Python, JavaScript, Rust or Go Experience working with one or more from the following: web application development, Unix/Linux environments, distributed and parallel systems, service oriented architectures, REST APIs, developing large software systems Experience working in teams following an agile software development methodology Basic knowledge of German    What we offer    Build products for a customer base of more than 5 million people across 5 countries Access the resources of a big corporate but get the freedom of working in an uncomplicated environment Work from home when you need to Competitive salary 9 out of 12 points on “The Joel Test” (  https://www.joelonsoftware.com/2000/08/09/the-joel-test-12-steps-to-better-code/)   A contact you should connect with We look forward to receiving your complete application documents. Please apply online only. Direct applications are preferred.  Apply online now    Valora — brightens up your journey    Would you like to know more about us? Valora Schweiz AGMladen Mumalomladen.mumalo@valora.com — www.valora.com   Social Media                       Share   Send   Print                       
 Display original ad",28.09.2019
Python Developer,"Scientific Consultant, Genedata Selector",2019-11-16,Genedata AG,Basel,100%,Position with responsibilities,"Scientific Consultant, Genedata Selector  Scientific Consultant, Genedata Selector, CH-Basel   The Position We are looking to fill an opening for a Scientific Consultant in our Selector Business Unit. The Genedata Selector® suite is an enterprise solution for managing and analyzing genome-related knowledge for strain, cell line and germplasm optimization. The software application enables processing of raw sequencing data, integration of genomic data with transcriptomics and metabolomics data, improved gene functional annotation, insights into molecular pathways and statistical analysis. As part of our professional services team, this position will act as an interface between science and sales, working closely with external customers and internal sales and software engineering teams. We are looking for someone who is self-motivated and a team-player with an ability to present and represent a complex software solution in an effective way. This full-time position is based out of our office in Basel, Switzerland and requires up to 20% travel within Europe, and occasional travel to North America and Japan.    Key Responsibilities  Scientific consulting and professional service projects, working with customer’s cross functional partners including scientific and IT partners Identify customer needs, and map them to the capabilities of the software Troubleshoot scientific and technical support issues and capture user feedback Communicate customer needs and coordinate activities internally with the scientific consulting and professional services team, business account managers and product managers Support our sales team with product expertise, scientific presentations, and software demonstrations Present the product vision of Genedata Selector to prospects and customers Internet-based and on-site product training sessions with customers Identify new business opportunities with business account managers Define appropriate service projects with customers to fulfill unmet needs    Your Profile  Essential Skills and Experience:   MSc or PhD in bioinformatics, biostatistics, molecular biology, microbiology, or similar discipline 3 years’ experience working in a biopharma, industrial biotech, agribusiness or related life sciences environment using standard bioinformatics tools and databases Next generation sequencing data processing and analysis skills Strong background in statistics Proficient working in a UNIX environment and with using a scripting or programming language (e.g. Perl, Python, Java) Familiar with SQL and relational databases (e.g. Oracle) Excellent written and verbal communication skills Fluency in English is a must Highly motivated self-starter Must be currently located in Europe    The Company Genedata is an exceptional company. With over two decades of success in research informatics due to closely-knit teams of scientists, developers and business experts, Genedata has achieved steady and continuous growth since inception. As a private and majority employee-owned organization, we empower each employee to be a contributing voice in the company operations and evolution. Our collective expertise in research informatics, combined with our open and scalable computational solutions, makes us the leading software provider in R&D informatics for biotech, pharmaceuticals, and related life sciences. We are headquartered in Basel, Switzerland and have subsidiaries in Germany, US, UK, Japan and Singapore.   About Genedata Selector Genedata Selector® is an enterprise software platform that transforms raw sequencing data into solutions to optimize R&D and production processes for life science industries. Automated and intuitive software combined with scientific consulting and professional services provides a full solution for increasing efficiency and reducing costs in cell line design and selection, microbial contamination detection, and strain, germplasm, and breeding optimization.   Are you interested? If you are interested in this position, please submit us your CV and motivation letter.Genedata only accepts CVs and resumes directly from candidates. Personnel recruitment agencies need not respond. Genedata is an Equal Opportunity Employer.    Apply now               Display original ad",05.09.2019
